{
  "schema_version": "ocr-qa-summary-v1",
  "summary_version": "ocr_qa_summary_demo_v1",
  "qa_run_id": "ocr_qa_demo_v1",
  "run_manifest_path": "manifests/templates/ocr_qa_run.example.json",
  "run_manifest_sha256": "aaaaaaaaaaaaaaaaaaaaaaaaaaaaaaaaaaaaaaaaaaaaaaaaaaaaaaaaaaaaaaaa",
  "page_results_path": "manifests/templates/demo/ocr_qa_pages.jsonl",
  "page_results_sha256": "bbbbbbbbbbbbbbbbbbbbbbbbbbbbbbbbbbbbbbbbbbbbbbbbbbbbbbbbbbbbbbbb",
  "formula_results_path": "manifests/templates/demo/ocr_qa_formulas.jsonl",
  "formula_results_sha256": "cccccccccccccccccccccccccccccccccccccccccccccccccccccccccccccccc",
  "sample_counts": {
    "selection_role": "stratified_random",
    "pdf_count": 30,
    "work_count": 30,
    "page_count": 100,
    "prose_characters": 20000,
    "formula_occurrences": 200,
    "formula_work_ids": 30,
    "manual_challenge_page_count": 0
  },
  "variant_results": [
    {
      "variant_id": "variant_demo_a_v1",
      "overall": {
        "selection_role": "stratified_random",
        "work_count": 30,
        "page_count": 100,
        "attempted_pages": 100,
        "successful_extraction_pages": 98,
        "extraction_success_rate": 0.98,
        "prose_characters": 20000,
        "character_errors": 900,
        "cer": 0.045,
        "cer_ci_upper": 0.052,
        "reference_words": 3200,
        "word_errors": 420,
        "wer": 0.13125,
        "wer_ci_upper": 0.15,
        "critical_reading_order_pages": 10,
        "critical_reading_order_rate": 0.1,
        "critical_reading_order_rate_ci_upper": 0.14,
        "formula_reference_count": 200,
        "formula_work_count": 30,
        "formula_true_positives": 170,
        "formula_false_negatives": 30,
        "formula_false_positives": 20,
        "formula_detection_f1": 0.8717948718,
        "formula_detection_f1_ci_lower": 0.84,
        "critical_formula_damage_count": 25,
        "critical_formula_damage_rate": 0.125,
        "critical_formula_damage_rate_ci_upper": 0.16,
        "prose_criteria_status": "fail",
        "formula_criteria_status": "fail"
      },
      "source_layout_groups": [
        {
          "group_id": "source_demo_journal_site__two_column",
          "selection_role": "stratified_random",
          "source_id": "source_demo_journal_site",
          "layout": "two_column",
          "work_count": 30,
          "page_count": 100,
          "attempted_pages": 100,
          "successful_extraction_pages": 98,
          "extraction_success_rate": 0.98,
          "prose_characters": 20000,
          "character_errors": 900,
          "cer": 0.045,
          "cer_ci_upper": 0.052,
          "reference_words": 3200,
          "word_errors": 420,
          "wer": 0.13125,
          "wer_ci_upper": 0.15,
          "critical_reading_order_pages": 10,
          "critical_reading_order_rate": 0.1,
          "critical_reading_order_rate_ci_upper": 0.14,
          "formula_reference_count": 200,
          "formula_work_count": 30,
          "formula_true_positives": 170,
          "formula_false_negatives": 30,
          "formula_false_positives": 20,
          "formula_detection_f1": 0.8717948718,
          "formula_detection_f1_ci_lower": 0.84,
          "critical_formula_damage_count": 25,
          "critical_formula_damage_rate": 0.125,
          "critical_formula_damage_rate_ci_upper": 0.16,
          "prose_criteria_status": "fail",
          "formula_criteria_status": "fail"
        }
      ],
      "manual_challenge_results": [],
      "meets_core_criteria": false,
      "h3_allowed": false,
      "selected_for_adoption": false
    },
    {
      "variant_id": "variant_demo_b_v1",
      "overall": {
        "selection_role": "stratified_random",
        "work_count": 30,
        "page_count": 100,
        "attempted_pages": 100,
        "successful_extraction_pages": 100,
        "extraction_success_rate": 1.0,
        "prose_characters": 20000,
        "character_errors": 300,
        "cer": 0.015,
        "cer_ci_upper": 0.022,
        "reference_words": 3200,
        "word_errors": 200,
        "wer": 0.0625,
        "wer_ci_upper": 0.08,
        "critical_reading_order_pages": 2,
        "critical_reading_order_rate": 0.02,
        "critical_reading_order_rate_ci_upper": 0.047,
        "formula_reference_count": 200,
        "formula_work_count": 30,
        "formula_true_positives": 190,
        "formula_false_negatives": 10,
        "formula_false_positives": 8,
        "formula_detection_f1": 0.9547738693,
        "formula_detection_f1_ci_lower": 0.88,
        "critical_formula_damage_count": 5,
        "critical_formula_damage_rate": 0.025,
        "critical_formula_damage_rate_ci_upper": 0.06,
        "prose_criteria_status": "pass",
        "formula_criteria_status": "fail"
      },
      "source_layout_groups": [
        {
          "group_id": "source_demo_journal_site__two_column",
          "selection_role": "stratified_random",
          "source_id": "source_demo_journal_site",
          "layout": "two_column",
          "work_count": 30,
          "page_count": 100,
          "attempted_pages": 100,
          "successful_extraction_pages": 100,
          "extraction_success_rate": 1.0,
          "prose_characters": 20000,
          "character_errors": 300,
          "cer": 0.015,
          "cer_ci_upper": 0.022,
          "reference_words": 3200,
          "word_errors": 200,
          "wer": 0.0625,
          "wer_ci_upper": 0.08,
          "critical_reading_order_pages": 2,
          "critical_reading_order_rate": 0.02,
          "critical_reading_order_rate_ci_upper": 0.047,
          "formula_reference_count": 200,
          "formula_work_count": 30,
          "formula_true_positives": 190,
          "formula_false_negatives": 10,
          "formula_false_positives": 8,
          "formula_detection_f1": 0.9547738693,
          "formula_detection_f1_ci_lower": 0.88,
          "critical_formula_damage_count": 5,
          "critical_formula_damage_rate": 0.025,
          "critical_formula_damage_rate_ci_upper": 0.06,
          "prose_criteria_status": "pass",
          "formula_criteria_status": "fail"
        }
      ],
      "manual_challenge_results": [],
      "meets_core_criteria": true,
      "h3_allowed": false,
      "selected_for_adoption": false
    }
  ],
  "decision_status": "insufficient",
  "recommendation": "revise_and_repeat",
  "decision_reason": "Синтетические фрагменты показывают формат, но не образуют полный запуск; проверка связей не выполнялась.",
  "unresolved_issues": ["Синтетические пути и хеши не указывают на полный комплект рабочего запуска."],
  "format_and_relation_checks": "not_run",
  "created_at": "2026-09-03T12:00:00+03:00"
}
